{
  "schema_version": 1,
  "hash_algorithm": "sha256-git-blobs-v1",
  "codex": {
    "bridge_root": ".agents/skills",
    "agent_root": ".codex/agents",
    "max_depth": 2,
    "max_threads": 6,
    "effort": "xhigh"
  },
  "dispatch": {
    "envelope_version": 1,
    "required_skills_field": "Required skills",
    "failure_prefix": "BLOCKED(skill-contract)"
  },
  "skills": [
    {
      "id": "skill:adversarial-verification",
      "codex_name": "govfolio-adversarial-verification",
      "description": "Adversarially re-derive Govfolio claims from evidence and issue actionable verdicts.",
      "status": "available",
      "source": {
        "canonical_path": "agents/skills/adversarial-verification",
        "tree_sha256": "8082c7e73ab42259cbd1a4bcb4524477f1917a60f0aba21dfceadb56cb0ad534",
        "file_count": 1
      },
      "dependencies": [],
      "restrictions": []
    },
    {
      "id": "skill:brainstorming",
      "codex_name": "govfolio-brainstorming",
      "description": "Explore requirements and produce an approved design before creative implementation work.",
      "status": "available",
      "source": {
        "canonical_path": "agents/skills/imported/superpowers@d884ae04edeb/brainstorming",
        "tree_sha256": "b0ed1d651c0051c986a49d2749f92af795d577f06c4b86fde23f1c1e4fa4279b",
        "file_count": 8
      },
      "dependencies": [
        "skill:writing-plans"
      ],
      "restrictions": []
    },
    {
      "id": "skill:conformance-diffing",
      "codex_name": "govfolio-conformance-diffing",
      "description": "Compare adapter output against reviewed fixtures and explain semantic differences.",
      "status": "available",
      "source": {
        "canonical_path": "agents/skills/conformance-diffing",
        "tree_sha256": "e43bab43b4f20fefdfa2f1e1eec928fe672d8aece6cef4e09b5e31708dd75196",
        "file_count": 1
      },
      "dependencies": [],
      "restrictions": []
    },
    {
      "id": "skill:dispatching-parallel-agents",
      "codex_name": "govfolio-dispatching-parallel-agents",
      "description": "Dispatch independent work to parallel agents without overlapping state.",
      "status": "available",
      "source": {
        "canonical_path": "agents/skills/imported/superpowers@d884ae04edeb/dispatching-parallel-agents",
        "tree_sha256": "957f1925a145110cf8e1bb9018bf8ba726dc0940d7d0550a9c64ab4cfc553a31",
        "file_count": 1
      },
      "dependencies": [],
      "restrictions": []
    },
    {
      "id": "skill:drift-detection",
      "codex_name": "govfolio-drift-detection",
      "description": "Detect, classify, rank, and report source drift against reviewed baselines.",
      "status": "available",
      "source": {
        "canonical_path": "agents/skills/drift-detection",
        "tree_sha256": "9786fc6702227993534a77462b182fc15a5c0e0d1cb2e5ade730acae738ef9a4",
        "file_count": 1
      },
      "dependencies": [],
      "restrictions": []
    },
    {
      "id": "skill:evidence-archiving",
      "codex_name": "govfolio-evidence-archiving",
      "description": "Archive primary-source evidence with stable provenance for Govfolio claims.",
      "status": "available",
      "source": {
        "canonical_path": "agents/skills/evidence-archiving",
        "tree_sha256": "618322744761e424a4ac5b430c9f429501dce94536f483cf8c55560b793c5615",
        "file_count": 1
      },
      "dependencies": [],
      "restrictions": []
    },
    {
      "id": "skill:executing-plans",
      "codex_name": "govfolio-executing-plans",
      "description": "Execute a reviewed implementation plan in gated batches with verification.",
      "status": "available",
      "source": {
        "canonical_path": "agents/skills/imported/superpowers@d884ae04edeb/executing-plans",
        "tree_sha256": "7b32eac840a51587b41c49818a6f0ec92473c67a638a81c215e68965e22b414e",
        "file_count": 1
      },
      "dependencies": [
        "skill:finishing-a-development-branch",
        "skill:using-git-worktrees",
        "skill:writing-plans"
      ],
      "restrictions": []
    },
    {
      "id": "skill:extraction-strategy",
      "codex_name": "govfolio-extraction-strategy",
      "description": "Design evidence-backed extraction mappings and flag every unresolved ambiguity.",
      "status": "available",
      "source": {
        "canonical_path": "agents/skills/extraction-strategy",
        "tree_sha256": "a6073c42f7358254e6d6c2e0e21d5b367ccce265f32dcdcf4c207d501831d5cb",
        "file_count": 1
      },
      "dependencies": [],
      "restrictions": []
    },
    {
      "id": "skill:finishing-a-development-branch",
      "codex_name": "govfolio-finishing-a-development-branch",
      "description": "Verify completed branch work and choose a safe integration outcome.",
      "status": "available",
      "source": {
        "canonical_path": "agents/skills/imported/superpowers@d884ae04edeb/finishing-a-development-branch",
        "tree_sha256": "7c07120372c030c043b846f464b71834afc2627916f379abd0576b6725db4484",
        "file_count": 1
      },
      "dependencies": [],
      "restrictions": []
    },
    {
      "id": "skill:fixture-capture",
      "codex_name": "govfolio-fixture-capture",
      "description": "Capture representative immutable source fixtures with complete manifests.",
      "status": "available",
      "source": {
        "canonical_path": "agents/skills/fixture-capture",
        "tree_sha256": "5d276e208c76b87d9b06bbdf46e1303d6d71d471809d4cdd6eb8f05d1f588fbb",
        "file_count": 1
      },
      "dependencies": [],
      "restrictions": []
    },
    {
      "id": "skill:frontend-design",
      "codex_name": "govfolio-frontend-design",
      "description": "Create distinctive, production-grade frontend interfaces with deliberate visual design.",
      "status": "available",
      "source": {
        "canonical_path": "agents/skills/imported/frontend-design@9d2f1ae18723",
        "tree_sha256": "77dd89a3cb102d4b433af8c3562770a8293acdacd884a5a2d4ebce4b75a7233c",
        "file_count": 2
      },
      "dependencies": [],
      "restrictions": []
    },
    {
      "id": "skill:human-gate-etiquette",
      "codex_name": "govfolio-human-gate-etiquette",
      "description": "Fail closed around Govfolio's residual legal, brand, and approval gates.",
      "status": "available",
      "source": {
        "canonical_path": "agents/skills/human-gate-etiquette",
        "tree_sha256": "7f8d9fc6521c906cd3ff554ab9dc712d8d0aca8b5f16bd9beb7d6265c6e4612b",
        "file_count": 1
      },
      "dependencies": [],
      "restrictions": []
    },
    {
      "id": "skill:impeccable",
      "codex_name": "govfolio-impeccable",
      "description": "Apply the pinned Impeccable design guidance in documentation-only mode.",
      "status": "available",
      "source": {
        "canonical_path": "agents/skills/imported/impeccable@582f23eae3c9/skills/impeccable",
        "tree_sha256": "5076d58119ab3b0cafc1732dca0318a4b90c97c52592c8f969a592b6998536f8",
        "file_count": 96
      },
      "dependencies": [],
      "restrictions": [
        "Docs-only: use only the canonical SKILL.md and docs/ guidance.",
        "Never execute, import, copy, adapt, or vendor any files under the canonical scripts/ directory or any other vendored script/code."
      ]
    },
    {
      "id": "skill:plan-decomposition",
      "codex_name": "govfolio-plan-decomposition",
      "description": "Decompose a Govfolio goal into small, command-gated implementation tasks.",
      "status": "available",
      "source": {
        "canonical_path": "agents/skills/plan-decomposition",
        "tree_sha256": "a0237b90fdb3f8f753682d8493a9f128cc57d655c4ffc4c9233b025f837dee49",
        "file_count": 1
      },
      "dependencies": [],
      "restrictions": []
    },
    {
      "id": "skill:polite-fetching",
      "codex_name": "govfolio-polite-fetching",
      "description": "Fetch official sources conditionally with bounded concurrency and source-specific politeness.",
      "status": "available",
      "source": {
        "canonical_path": "agents/skills/polite-fetching",
        "tree_sha256": "3e473ae345acf99a9172180066d82397bdfdf17357a268cde94c89b9f738cd2c",
        "file_count": 1
      },
      "dependencies": [],
      "restrictions": []
    },
    {
      "id": "skill:receiving-code-review",
      "codex_name": "govfolio-receiving-code-review",
      "description": "Evaluate code-review feedback technically before applying verified changes.",
      "status": "available",
      "source": {
        "canonical_path": "agents/skills/imported/superpowers@d884ae04edeb/receiving-code-review",
        "tree_sha256": "072b604b8cb6775f23679cc92d0fa8be74ac13f15943f6e96b03a5ead267fa60",
        "file_count": 1
      },
      "dependencies": [],
      "restrictions": []
    },
    {
      "id": "skill:regime-research",
      "codex_name": "govfolio-regime-research",
      "description": "Research official financial-disclosure regimes from primary evidence without inference.",
      "status": "available",
      "source": {
        "canonical_path": "agents/skills/regime-research",
        "tree_sha256": "82bdecadd9b3f7f9c9a42ebb4d8632b5f146e95a72b16bf4522043606c29fa8a",
        "file_count": 1
      },
      "dependencies": [],
      "restrictions": []
    },
    {
      "id": "skill:requesting-code-review",
      "codex_name": "govfolio-requesting-code-review",
      "description": "Request focused code review against requirements and concrete diff evidence.",
      "status": "available",
      "source": {
        "canonical_path": "agents/skills/imported/superpowers@d884ae04edeb/requesting-code-review",
        "tree_sha256": "871b031e58a2468ae1680a871e6022abf0ff1dc9bbcda6d1bd9939bf802940b8",
        "file_count": 2
      },
      "dependencies": [],
      "restrictions": []
    },
    {
      "id": "skill:rust-async-patterns",
      "codex_name": "govfolio-rust-async-patterns",